{
  "$schema": "https://json-schema.org/draft/2020-12/schema",
  "title": "Agency Schema",
  "description": "Schema for agency changes in Producerflow",
  "type": "object",
  "properties": {
    "id": {
      "type": "string",
      "minLength": 1,
      "description": "Unique identifier for the change"
    },
    "event_type": {
      "type": "string",
      "minLength": 1,
      "description": "Type of event that occurred (e.g., 'agency.updated', 'agency.synced', 'agency.retired')"
    },
    "origin": {
      "type": "string",
      "enum": ["ProducerFlowAPI", "ProducerFlowPortal", "NIPR"],
      "description": "Source of the change"
    },
    "timestamp": {
      "type": "string",
      "format": "date-time",
      "description": "Time when the change occurred"
    },
    "agency_id": {
      "type": "string",
      "minLength": 1,
      "description": "Always present. Unique identifier for the agency"
    },
    "external_id": {
      "type": "string",
      "description": "Only present if filled in by tenant. External identifier for the agency"
    },
    "fein": {
      "type": "string",
      "description": "Always present if agency is not a sole proprietor. Federal Employer Identification Number"
    },
    "npn": {
      "type": "string",
      "description": "Always present if agency is not a sole proprietor. National Producer Number"
    },
    "agency_data": {
      "type": "object",
      "description": "Present when agency is created or when any agency data fields (email, phone, fax, name, website, is_sole_proprietor) are updated. Contains basic agency information",
      "properties": {
        "email": { "type": "string", "format": "email" },
        "fax": { "type": "string" },
        "name": { "type": "string" },
        "phone": { "type": "string" },
        "website": { "type": "string", "format": "uri" },
        "is_sole_proprietor": {
          "type": "boolean",
          "description": "Whether the agency is a sole proprietorship"
        }
      }
    },
    "agency_address": {
      "type": "array",
      "description": "Present when agency is created or when agency addresses change. Contains address information for the agency",
      "items": {
        "type": "object",
        "properties": {
          "address_type": { "type": "string" },
          "street": { "type": "string" },
          "address_line_2": { "type": "string" },
          "city": { "type": "string" },
          "state": { "type": "string" },
          "zip": { "type": "string" }
        }
      }
    },
    "agency_bank_account": {
      "type": "object",
      "description": "Present when agency is created or when agency bank account changes. Contains bank account information for the agency",
      "properties": {
        "bank_account_id": { "type": "string" },
        "account_number": { "type": "string" },
        "routing_number": { "type": "string" },
        "account_type": { "type": "string" },
        "account_holder_name": { "type": "string" }
      }
    },
    "agency_eo": {
      "type": "object",
      "description": "Present when agency is created or when E&O coverage changes. Contains the agency's effective E&O insurance information. When the agency belongs to an organization that shares its own E&O, these are the organization's coverage values rather than the agency's own record. An empty object means the agency has no E&O in effect: an omitted section means unchanged, so a coverage that went away is reported as an empty one",
      "properties": {
        "carrier": { "type": "string" },
        "expiration_date": { "type": "string", "format": "date" },
        "effective_date": { "type": "string", "format": "date" },
        "coverage_amount": { "type": "string" },
        "coverage_status": { "type": "string", "description": "Status of the E&O coverage" }
      }
    },
    "agency_ivans_account": {
      "type": "object",
      "description": "Present when agency is created or when IVANS account changes. Contains IVANS integration information for the agency",
      "properties": {
        "account_number": { "type": "string" },
        "ams_software": { "type": "string" },
        "ams_version": { "type": "string" },
        "mailbox_number": { "type": "string" }
      }
    },
    "agency_nipr_data": {
      "type": "object",
      "description": "Present when NIPR data is synced for the agency. Contains agency information from NIPR",
      "properties": {
        "business_email": { "type": "string", "format": "email" },
        "business_phone": { "type": "string" },
        "company_name": { "type": "string" },
        "fein": { "type": "string" },
        "npn": { "type": "string" }
      }
    },
    "agency_nipr_appointments": {
      "type": "array",
      "description": "Present when NIPR data is synced for the agency. Contains all current carrier appointments from NIPR",
      "items": {
        "type": "object",
        "properties": {
          "carrier_code": { "type": "string" },
          "carrier_fein": { "type": "string" },
          "company_name": { "type": "string" },
          "loa": { "type": "string" },
          "loa_code": { "type": "string" },
          "state": { "type": "string" },
          "status": { "type": "string" },
          "termination_reason": { "type": "string" },
          "status_reason_date": { "type": "string", "format": "date" },
          "renewal_date": { "type": "string", "format": "date" }
        }
      }
    },
    "agency_nipr_licenses": {
      "type": "array",
      "description": "Present when NIPR data is synced for the agency. Contains all current licenses with their LOAs from NIPR",
      "items": {
        "type": "object",
        "properties": {
          "license_id": {
            "type": "string",
            "format": "string",
            "description": "Unique identifier for the license"
          },
          "expiration_date": { "type": "string", "format": "date" },
          "is_active": { "type": "boolean" },
          "issue_date": { "type": "string", "format": "date" },
          "license_class": { "type": "string" },
          "license_class_code": { "type": "string" },
          "npn": { "type": "string" },
          "license_number": { "type": "string" },
          "residency_status": { "type": "string" },
          "designated_home_state": { "type": "string" },
          "license_state": { "type": "string" },
          "loas": {
            "type": "array",
            "items": {
              "type": "object",
              "properties": {
                "loa": { "type": "string" },
                "loa_code": { "type": "string" },
                "is_active": { "type": "boolean" },
                "status_reason": { "type": "string" },
                "issue_date": { "type": "string", "format": "date" },
                "status_reason_date": { "type": "string", "format": "date" },
                "ce_compliance": { "type": "string" },
                "ce_renewal_date": { "type": "string", "format": "date" },
                "ce_credits_needed": { "type": "string" }
              }
            }
          }
        }
      }
    },
    "agency_nipr_addresses": {
      "type": "array",
      "description": "Present when NIPR data is synced for the agency. Contains all addresses from NIPR",
      "items": {
        "type": "object",
        "properties": {
          "address_type": { "type": "string" },
          "city": { "type": "string" },
          "country": { "type": "string" },
          "state": { "type": "string" },
          "street": { "type": "string" },
          "zip_code": { "type": "string" }
        }
      }
    },
    "agency_nipr_regulatory_actions": {
      "type": "array",
      "description": "Present when NIPR data is synced for the agency. Contains all regulatory actions from NIPR",
      "items": {
        "type": "object",
        "properties": {
          "state": { "type": "string" },
          "reason_for_action": { "type": "string" },
          "disposition": { "type": "string" },
          "date_of_action": { "type": "string", "format": "date" },
          "effective_date": { "type": "string", "format": "date" },
          "enter_date": { "type": "string", "format": "date" },
          "file_reference": { "type": "string" },
          "penalty_fine_forfeiture": { "type": "string" },
          "length_of_order": { "type": "string" },
          "origin_of_action": { "type": "string" }
        }
      }
    },
    "requested_appointment_states": {
      "type": "array",
      "description": "Present when agency is created or when the requested appointment states are updated. Contains the list of US state codes where appointments are requested. When present, this field is always an array (never null); an empty array indicates all requested states have been cleared",
      "items": {
        "type": "string"
      }
    },
    "nipr_sync_status": {
      "type": "string",
      "enum": ["active", "failing", "pending", "disabled"],
      "description": "Always present. NIPR synchronization status of the agency (disabled, pending, failing, active)"
    },
    "nipr_sync_status_updated_at": {
      "type": "string",
      "format": "date-time",
      "description": "Always present. ISO 8601 timestamp when the NIPR synchronization status was last updated"
    },
    "organization": {
      "type": "object",
      "description": "Present when the agency's organization assignment changes. Contains organization details.",
      "properties": {
        "organization_id": {
          "type": "string",
          "description": "Unique internal identifier for the organization"
        },
        "name": {
          "type": "string",
          "description": "Display name of the organization"
        },
        "external_id": {
          "type": "string",
          "description": "Always present if filled in by tenant. External identifier for the organization from an external system"
        },
        "email": {
          "type": "string",
          "description": "Contact email address for the organization"
        },
        "relationship_type": {
          "type": "string",
          "enum": ["main", "related"],
          "description": "Always present. Type of relationship between the agency and organization. 'main' indicates a main/sub-agency created for the organization, 'related' indicates an external agency assigned to the organization"
        },
        "unassigned": {
          "type": "boolean",
          "description": "Only present when true, indicates the agency has been removed from this organization. When this happens, the other fields contain details about the organization to which the agency was previously assigned"
        }
      }
    },
    "agency_principal": {
      "type": "object",
      "description": "Always present if the agency has a principal. Contains principal information for the agency",
      "properties": {
        "principal_id": {
          "type": "string",
          "description": "Always present. Unique identifier for the principal"
        },
        "principal_external_id": {
          "type": "string",
          "description": "Only present if filled in by tenant. External identifier for the principal"
        },
        "principal_type": {
          "type": "string",
          "enum": ["producer", "contact"],
          "description": "Always present. Type of the principal: 'producer' if the principal is a licensed producer, 'contact' if the principal is an unlicensed contact"
        }
      }
    },
    "tenant_additional_questions": {
      "type": "object",
      "description": "Present when the tenant_additional_questions field changes. An empty object ({}) means the field was cleared; absent means the field was not changed in this event. Contains custom additional questions and answers as key-value pairs collected during agency onboarding",
      "additionalProperties": {
        "type": "string"
      }
    },
    "external_metadata": {
      "type": "object",
      "description": "Present when the external_metadata field changes. An empty object ({}) means the field was cleared; absent means the field was not changed in this event. Contains tenant-specific metadata as key-value pairs allowing tenants to attach their own business attributes, computed values, or derived data to agencies",
      "additionalProperties": {
        "type": "string"
      }
    },
    "locations": {
      "type": "array",
      "description": "Present when agency is created or when agency locations change. Contains all current locations for the agency. An empty array ([]) means all locations have been removed; absent field means locations were not updated.",
      "items": {
        "type": "object",
        "properties": {
          "location_id": {
            "type": "string",
            "description": "Unique identifier for the location"
          },
          "external_id": {
            "type": "string",
            "description": "Only present if filled in by tenant. External identifier for this location from an external system"
          },
          "name": {
            "type": "string",
            "description": "Name of the location"
          },
          "street": {
            "type": "string",
            "description": "Street address of this location"
          },
          "address_line_2": {
            "type": "string",
            "description": "Second line of the street address (e.g., apartment, suite, unit number)"
          },
          "city": {
            "type": "string",
            "description": "City of this location"
          },
          "state": {
            "type": "string",
            "description": "State or province of this location"
          },
          "zip": {
            "type": "string",
            "description": "Postal code of this location"
          },
          "phone": {
            "type": "string",
            "description": "Contact phone number for this location"
          },
          "email": {
            "type": "string",
            "format": "email",
            "description": "Contact email for this location"
          },
          "is_primary": {
            "type": "boolean",
            "description": "Whether this is the primary location for the agency"
          },
          "bank_account": {
            "type": "object",
            "description": "Optional bank account associated with this location. Present only when the location has bank account information.",
            "properties": {
              "bank_account_id": {
                "type": "string",
                "description": "Unique identifier for the bank account"
              },
              "account_number": {
                "type": "string",
                "description": "Bank account number"
              },
              "routing_number": {
                "type": "string",
                "description": "ABA routing number"
              },
              "account_type": {
                "type": "string",
                "description": "Type of bank account (e.g., checking, savings)"
              },
              "account_holder_name": {
                "type": "string",
                "description": "Name of the account holder"
              }
            }
          }
        }
      }
    },
    "contract_status": {
      "type": "string",
      "enum": ["unsigned", "sent", "signed", "failed"],
      "description": "Present when agency contract status changes. Current status of the agency's contract"
    },
    "replacement_agency_id": {
      "type": "string",
      "description": "Present only for 'agency.retired', when another agency replaced it in a legal entity change. ID of the replacement agency"
    },
    "external_replacement_agency_id": {
      "type": "string",
      "description": "Present only for 'agency.retired', when filled in by tenant. External ID of the replacement agency"
    },
    "reason": {
      "type": "string",
      "enum": ["acquired", "merged"],
      "description": "Present only for 'agency.retired'. Why the agency retired"
    }
  },
  "required": ["id", "event_type", "origin", "timestamp", "agency_id"],
  "additionalProperties": false
}
