{
  "id": "chg_123456789",
  "event_type": "agency.updated",
  "origin": "ProducerFlowAPI",
  "timestamp": "2024-03-20T15:30:45Z",
  "agency_id": "agc_987654321",
  "external_id": "ext_123",
  "fein": "12-3456789",
  "npn": "1234567",

  "agency_data": {
    "email": "contact@insuranceagency.com",
    "fax": "555-123-4567",
    "name": "Premier Insurance Agency LLC",
    "phone": "555-987-6543",
    "status": "Active",
    "website": "www.premierinsurance.com"
  },

  "agency_address": [
    {
      "address_type": "Business",
      "street": "123 Insurance Ave",
      "address_line_2": "Suite 500",
      "city": "Chicago",
      "state": "IL",
      "zip": "60601"
    }
  ],

  "agency_bank_account": {
    "bank_account_id": "ba_123456",
    "account_number": "****4321",
    "routing_number": "071000013",
    "account_type": "Checking",
    "account_holder_name": "Premier Insurance Agency LLC"
  },

  "agency_eo": {
    "carrier": "Professional Coverage Corp",
    "expiration_date": "2025-12-31",
    "effective_date": "2024-01-01",
    "coverage_amount": "1000000"
  },

  "agency_ivans_account": {
    "account_number": "IV123456",
    "ams_software": "Applied Epic",
    "ams_version": "2024.1",
    "mailbox_number": "MB789"
  },

  "agency_nipr_data": {
    "business_email": "licensing@insuranceagency.com",
    "business_phone": "555-999-8888",
    "company_name": "Premier Insurance Agency LLC",
    "fein": "12-3456789",
    "npn": "1234567"
  },

  "agency_nipr_appointments": [
    {
      "carrier_code": "12345",
      "carrier_fein": "98-7654321",
      "company_name": "Big Insurance Co",
      "loa": "Property and Casualty",
      "loa_code": "PC",
      "state": "IL",
      "status": "Active",
      "status_reason_date": "2024-01-01",
      "renewal_date": "2025-01-01"
    }
  ],

  "agency_nipr_licenses": [
    {
      "license_id": "a1b2c3d4-e5f6-7890-abcd-ef1234567890",
      "expiration_date": "2025-12-31",
      "is_active": true,
      "issue_date": "2024-01-01",
      "license_class": "Producer",
      "license_class_code": "PR",
      "npn": "1234567",
      "license_number": "987654",
      "residency_status": "Resident",
      "designated_home_state": "",
      "license_state": "IL",
      "loas": [
        {
          "loa": "Life Insurance",
          "loa_code": "LI",
          "is_active": true,
          "status_reason": "Active",
          "issue_date": "2020-01-01",
          "status_reason_date": "2020-01-01",
          "ce_compliance": "Compliant",
          "ce_renewal_date": "2025-01-01",
          "ce_credits_needed": "0"
        }
      ]
    }
  ],
  "agency_nipr_addresses": [
    {
      "address_type": "Business",
      "city": "Chicago",
      "country": "USA",
      "state": "IL",
      "street": "123 Insurance Ave",
      "zip_code": "60601"
    }
  ],
  "agency_nipr_regulatory_actions": [
    {
      "state": "IL",
      "reason_for_action": "Failure to respond to inquiry",
      "disposition": "Fine",
      "date_of_action": "2024-02-15",
      "effective_date": "2024-03-01",
      "enter_date": "2024-02-20",
      "file_reference": "2024-000123",
      "penalty_fine_forfeiture": "500",
      "length_of_order": "12 months",
      "origin_of_action": "State Regulatory Agency"
    }
  ],
  "requested_appointment_states": ["OH", "FL"],
  "nipr_sync_status": "active",
  "nipr_sync_status_updated_at": "2024-03-20T15:30:45Z",
  "organization": {
    "organization_id": "org_123456789",
    "name": "Agentero Insurance Organization",
    "external_id": "ext_org_456",
    "relationship_type": "related"
  },
  "tenant_additional_questions": {
    "preferred_contact_method": "Email",
    "years_in_business": "15",
    "number_of_agents": "25"
  },
  "external_metadata": {
    "crm_id": "CRM-12345",
    "tier": "gold",
    "region": "midwest"
  },
  "locations": [
    {
      "location_id": "loc_123456",
      "external_id": "ext_loc_001",
      "name": "Chicago Main Office",
      "street": "123 Insurance Ave",
      "address_line_2": "Suite 500",
      "city": "Chicago",
      "state": "IL",
      "zip": "60601",
      "phone": "555-987-6543",
      "email": "chicago@insuranceagency.com",
      "is_primary": true,
      "bank_account": {
        "bank_account_id": "ba_abc123",
        "account_number": "123456789",
        "routing_number": "021000021",
        "account_type": "checking",
        "account_holder_name": "Chicago Insurance Agency LLC"
      }
    },
    {
      "location_id": "loc_789012",
      "name": "Springfield Branch",
      "street": "456 Capital Blvd",
      "address_line_2": "Floor 2",
      "city": "Springfield",
      "state": "IL",
      "zip": "62701",
      "phone": "555-123-7890",
      "email": "springfield@insuranceagency.com",
      "is_primary": false
    }
  ],
  "contract_status": "signed"
}
